{
  "schemaVersion": "deck-spec/1",
  "meta": {
    "title": "월간 실적 보고 (파이프라인 픽스처)",
    "deckLabel": "월간 실적 보고",
    "org": "default",
    "archetype": "status_report",
    "fileName": "월간_실적_보고.pptx"
  },
  "_notes": [
    "deck:data 파이프라인 검증용 픽스처 — 수치는 전부 가상(data/sources.json 참조).",
    "반복 보고 리허설: data/*.tsv 수치 교체 → npm run deck:data -- decks/sample-monthly → deck:build"
  ],
  "slides": [
    {
      "id": "m1",
      "template": "kpi_tiles",
      "label": "실적 요약",
      "pill": "지표",
      "head": {
        "runs": [
          {
            "t": "핵심 지표 3개 중 2개가 계획을 "
          },
          {
            "t": "초과 달성",
            "hl": true
          },
          {
            "t": "함"
          }
        ],
        "sub": "손해율은 계획을 상회하여 요인 분석을 병행함"
      },
      "p": {
        "tiles": [
          {
            "label": "신계약",
            "value": "1,240건",
            "delta": "전월 대비 증가",
            "note": "목표 1,100건",
            "tone": "ok"
          },
          {
            "label": "보험료 수익",
            "value": "91억원",
            "delta": "계획 초과",
            "note": "계획 84억원",
            "tone": "ok"
          },
          {
            "label": "손해율",
            "value": "85%",
            "delta": "계획 상회",
            "note": "계획 82%",
            "tone": "problem"
          }
        ]
      },
      "source": {
        "label": "예시 데이터(테스트용)",
        "file": "data/지표.tsv",
        "asOf": "2026-07"
      },
      "footnote": "* 자료: 예시 데이터(테스트용), 2026-07 기준"
    },
    {
      "id": "m2",
      "template": "perf_table",
      "label": "계획 대비 실적",
      "pill": "실적표",
      "head": {
        "runs": [
          {
            "t": "신계약과 보험료 수익이 계획 대비 "
          },
          {
            "t": "100%를 초과",
            "hl": true
          },
          {
            "t": "함"
          }
        ]
      },
      "band": "월간 핵심 지표, 계획 대비",
      "p": {
        "cols": [
          "계획",
          "실적",
          "달성률"
        ],
        "rows": [
          {
            "l": "신계약",
            "cells": [
              "1,100건",
              "1,240건",
              {
                "t": "113%",
                "tone": "ok"
              }
            ],
            "sub": "월납 환산"
          },
          {
            "l": "보험료 수익",
            "cells": [
              "84억원",
              "91억원",
              {
                "t": "108%",
                "tone": "ok"
              }
            ]
          },
          {
            "l": "13회차 유지율",
            "cells": [
              "85%",
              "87%",
              {
                "t": "102%",
                "tone": "ok"
              }
            ]
          }
        ],
        "hiCol": 2,
        "unit": "단위: 건·억원"
      },
      "source": {
        "label": "예시 데이터(테스트용)",
        "file": "data/실적.tsv",
        "asOf": "2026-07"
      },
      "footnote": "* 자료: 예시 데이터(테스트용), 2026-07 기준"
    },
    {
      "id": "m3",
      "template": "compare_table",
      "label": "계열사 비교",
      "pill": "비교표",
      "head": {
        "runs": [
          {
            "t": "성장률과 유지율에서 당사가 "
          },
          {
            "t": "우위",
            "hl": true
          },
          {
            "t": "를 유지함"
          }
        ],
        "sub": "손해율은 업계 평균 수준으로 관리됨"
      },
      "band": "주요 지표 사별 비교",
      "p": {
        "cols": [
          "당사",
          "A생명",
          "B생명"
        ],
        "rows": [
          {
            "l": "신계약 성장률",
            "cells": [
              "+18%",
              "+9%",
              "+12%"
            ]
          },
          {
            "l": "13회차 유지율",
            "cells": [
              "87%",
              "84%",
              "81%"
            ]
          },
          {
            "l": "손해율",
            "cells": [
              "85%",
              "83%",
              "88%"
            ]
          }
        ],
        "hiCol": 0
      },
      "source": {
        "label": "예시 데이터(테스트용)",
        "file": "data/계열사.tsv",
        "asOf": "2026-06"
      },
      "footnote": "* 자료: 예시 데이터(테스트용), 2026-06 기준"
    },
    {
      "id": "m4",
      "template": "trend",
      "label": "보험료 추이",
      "pill": "추세",
      "head": {
        "runs": [
          {
            "t": "월초 보험료가 5개월 연속 "
          },
          {
            "t": "증가",
            "hl": true
          },
          {
            "t": "함"
          }
        ]
      },
      "band": "월초 보험료 월별 추이",
      "p": {
        "pts": [
          {
            "l": "3월",
            "v": 62
          },
          {
            "l": "4월",
            "v": 71
          },
          {
            "l": "5월",
            "v": 79
          },
          {
            "l": "6월",
            "v": 86
          },
          {
            "l": "7월",
            "v": 94
          }
        ],
        "note": "증가 추세"
      },
      "source": {
        "label": "예시 데이터(테스트용)",
        "file": "data/추이.tsv",
        "asOf": "2026-07"
      },
      "footnote": "* 자료: 예시 데이터(테스트용), 2026-07 기준"
    }
  ]
}
