{
  "schemaVersion": "deck-spec/1",
  "_notes": [
    "골든 샘플 — 핸드오프 build_v5r.js 산출물(New종신_컨셉_비교형_리빌드.pptx)의 deck-spec 재현.",
    "expected_text.md 대조 시 의도된 차이 (룰북 v0.2 픽스): ",
    "1) s2 compareLine에 ' (출처 확인 필요)' 추가 — F15 타사 사실 주장 출처 규정",
    "2) s3 빨강 강조 박스 제거·finalTag를 ours(파랑)로 — F6/V1/V2 (텍스트 동일, 색·주석 레이어만 변경)",
    "3) s3 범례를 첫 그룹 직접 라벨로 대체 — V5 (텍스트 동일)",
    "4) s4 중도부가 계열 색을 fn2로 통일 — V3 색 의미 일관화 (텍스트 불변)",
    "5) s6 각주 신설 '* 인하 폭은 등급당 5~6% 가정의 예시임' — F8 (22% 인하 예시가 가정 수치)",
    "6) s5·s6은 v0.1에서 유사 폼 연속이던 것을 compare_rows/compare_cards 별개 템플릿으로 분리 — 폼 변주 규정 충족"
  ],
  "meta": {
    "title": "New종신",
    "deckLabel": "New종신 컨셉 보고",
    "author": "상품개발팀",
    "date": "2026",
    "org": "default",
    "archetype": "concept_proposal",
    "fileName": "New종신_컨셉_비교형_리빌드_v0.2.pptx"
  },
  "slides": [
    {
      "id": "s1",
      "template": "cover",
      "p": {
        "eyebrow": "상품구조 Transformation  |  파일럿 컨셉",
        "title": "New종신",
        "subtitle": "보험기간 중 요율 재산정과 담보 변경이 가능한 간편고지 종신보험",
        "credit": "상품개발팀  ·  2026"
      }
    },
    {
      "id": "s2",
      "template": "feature_cards",
      "label": "상품 개요",
      "pill": "상품 컨셉",
      "head": {
        "runs": [
          { "t": "보험기간 중 " },
          { "t": "요율 재산정", "hl": true },
          { "t": "과 " },
          { "t": "담보 변경", "hl": true },
          { "t": "이 가능한 간편고지 종신보험임" }
        ],
        "sub": "간편고지 3·1·5~3·5·5 종신 + 통합한도 건강담보 1종, 해지·재가입 없이 한 계약 내에서 변경함"
      },
      "p": {
        "cards": [
          {
            "title": "무사고 전환 (리밸런싱)",
            "lines": ["무사고 1년마다 요율등급 1단계 하향", "최대 3·5·5  ·  해지 없이 전환  ·  정산금 지급"],
            "chip": "보험료 인하",
            "fn": "fn1"
          },
          {
            "title": "중도부가 · 보장전환",
            "lines": ["보험기간 중 담보 추가", "재원: 추가 보험료(중도부가) · 적립금(보장전환)", "대상 담보 동일  ·  니즈 시점에 결정"],
            "chip": "담보 추가",
            "fn": "fn2"
          }
        ],
        "joiner": "+",
        "strip": {
          "lead": "다이나믹 프라이싱:  ",
          "text": "위 두 기능의 작동 전제로 모든 변경 시점에 그 시점 건강으로 재산정, 거절 없는 인수"
        },
        "compareLine": "타사 유사 기능은 대상·금액·시점이 가입 시점에 확정됨(삼성·DB·신한 동일), New종신은 보험기간 중 변경 가능함 (출처 확인 필요)"
      },
      "footnote": "* 3·1·5: 3개월 치료이력 · 1년 입원수술 · 5년 중대질병 고지, 뒤로 갈수록 완화된 등급",
      "notes": "한 계약 안에서 요율과 담보가 함께 움직인다는 것이 핵심 — 두 기능이 별개 옵션이 아니라 다이나믹 프라이싱 위에서 작동함을 구두로 강조."
    },
    {
      "id": "s3",
      "template": "bars",
      "label": "1. 무사고 전환 (리밸런싱)",
      "pill": "➊ 요율등급 하향",
      "head": {
        "runs": [
          { "t": "무사고 1년마다 요율등급이 " },
          { "t": "1단계 하향", "hl": true },
          { "t": "됨 (최대 3·5·5)" }
        ],
        "sub": "해지 없이 전환되어 면책·감액 기간 미발생, 등급 간 준비금 차액은 정산금으로 지급됨"
      },
      "band": "무사고 기간 경과에 따른 보험료 추이  (예시)",
      "p": {
        "unit": "보험료 지수 (가입 = 100)",
        "series": [
          { "label": "기존 간편고지", "role": "legacyBar" },
          { "label": "New종신", "role": "ours" }
        ],
        "groups": [
          { "l": "가입", "tag": "3·1·5", "vs": [100, 100] },
          { "l": "+1년", "tag": "3·2·5", "vs": [100, 94] },
          { "l": "+2년", "tag": "3·3·5", "vs": [100, 88] },
          { "l": "+3년", "tag": "3·4·5", "vs": [100, 83] },
          { "l": "+4년", "tag": "3·5·5", "vs": [100, 78] }
        ],
        "baseline": { "v": 100, "label": "가입 시점 100" },
        "hi": 4,
        "callout": { "text": "등급 하향 시 준비금 차액을 정산금으로 지급" },
        "finalTag": { "text": "4등급 하향 · 보험료 22% 인하 (예시)", "role": "ours" }
      },
      "stamps": [
        { "mark": "✕", "role": "problem", "text": "기존: 인하 수단은 해지 후 재가입  →  보장 공백" },
        { "mark": "○", "role": "ours", "text": "New종신: 해지 없이 전환 · 정산금 지급 · 공백 없음" }
      ],
      "assumed": true,
      "footnote": "* 보험료 지수는 예시 가정(등급당 5~6%)이며 실제 요율은 산출 결과에 따름"
    },
    {
      "id": "s4",
      "template": "journey",
      "label": "2. 중도부가 · 보장전환",
      "pill": "➋ 담보 추가",
      "head": {
        "runs": [
          { "t": "보험기간 중 담보를 추가할 수 있음, 시점·재원은 " },
          { "t": "고객이 선택", "hl": true },
          { "t": "함" }
        ],
        "sub": "재원은 추가 보험료(중도부가) 또는 적립금(보장전환), 대상 담보는 동일함"
      },
      "band": "가입자 여정 (30세 가입 예시)",
      "p": {
        "caption": "보장 구성",
        "bands": [
          { "text": "종신사망 (주계약)", "role": "ours", "from": 0 },
          { "text": "정기특약(사망보장 증액)", "role": "fn2", "from": 2 },
          { "text": "월렛 특약(통합한도 건강)", "role": "fn2", "from": 3 }
        ],
        "nodes": [
          { "age": "30세", "ev": "가입", "sub": "종신사망만", "role": "legacyDark", "pos": 0.054 },
          { "age": "35세", "ev": "무사고 전환", "sub": "3·1·5→3·2·5 · 정산금 (예시)", "role": "fn1", "pos": 0.295 },
          { "age": "36세", "ev": "정기특약 중도부가", "chip": "재원: 추가 보험료", "role": "fn2", "pos": 0.491 },
          { "age": "55세", "ev": "월렛 보장전환", "chip": "재원: 적립금", "role": "fn2", "pos": 0.759 }
        ],
        "strip": "다이나믹 프라이싱: 모든 변경 시점에 그 시점 건강으로 재산정, 악화 시에도 거절 없음"
      },
      "assumed": true,
      "footnote": "* 여정·연령은 예시, 중도부가·보장전환의 대상 담보는 동일하며 재원만 상이함"
    },
    {
      "id": "s5",
      "template": "compare_rows",
      "label": "3. 다이나믹 프라이싱",
      "pill": "➌ 요율 재산정",
      "head": {
        "runs": [
          { "t": "모든 변경 시점에 그 시점 건강으로 " },
          { "t": "요율을 재산정", "hl": true },
          { "t": "함" }
        ],
        "sub": "간편고지 3문항 · 무조건 인수, 무사고 전환·중도부가·보장전환 모두 이 재산정을 전제로 작동함"
      },
      "p": {
        "leftTitle": "기존 간편고지 종신",
        "rightTitle": "New종신",
        "rows": [
          {
            "tag": "건강 개선",
            "tagSub": "무사고 4년",
            "left": { "mark": "✕", "main": "보험료 변동 없음", "sub": "가입 요율로 만기까지 지수 100 유지" },
            "right": { "mark": "○", "main": "3·5·5 인하 + 정산금", "sub": "보험료 지수 100 → 78 (예시)" }
          },
          {
            "tag": "건강 악화",
            "tagSub": "고혈압 진단 (예시)",
            "left": { "mark": "✕", "main": "거절 또는 부담보", "sub": "보장을 추가할 수 없음" },
            "right": { "mark": "○", "main": "3·4·5 인수 · 거절 없음", "sub": "그 시점 등급으로 요율 반영" }
          }
        ],
        "leftSummary": "개선·악화 모두 미반영됨",
        "rightSummary": "개선·악화 모두 그 시점 요율로 반영됨"
      },
      "assumed": true,
      "footnote": "* 지수는 등급당 5~6% 가정 예시, 재산정 발생 시점은 무사고 전환·중도부가·보장전환"
    },
    {
      "id": "s6",
      "template": "compare_cards",
      "label": "4. 기대 효과 및 검토 필요 사항",
      "pill": "기대 효과",
      "head": {
        "runs": [
          { "t": "건강 변화·니즈 발생 시점의 " },
          { "t": "고객 결과가 개선", "hl": true },
          { "t": "됨" }
        ],
        "sub": "파일럿 대상: 사망담보(요율 고정 기간 최장, 담보 수 최소로 기능 검증 가능)"
      },
      "p": {
        "leftTitle": "기존 종신",
        "rightTitle": "New종신",
        "darkRight": true,
        "cards": [
          { "side": "left", "mark": "✕", "main": "건강 개선 시", "sub": "요율 변동 없음, 인하 수단은 해지·재가입뿐" },
          { "side": "left", "mark": "✕", "main": "보장 니즈 발생 시", "sub": "추가 불가, 악화 시 신규 가입도 거절·부담보" },
          { "side": "right", "mark": "○", "main": "건강 개선 시", "sub": "요율등급 하향(최대 22% 인하 예시) + 정산금 지급" },
          { "side": "right", "mark": "○", "main": "보장 니즈 발생 시", "sub": "중도부가·보장전환으로 추가, 거절 없음" }
        ],
        "reviewBox": {
          "title": "검토 필요 사항 (병행 진행 중)",
          "text": "① 계리: 무사고·사망률 상관 검증, 정산금 구조      ② 규제: 중도부가 분류, 정산금 법적 성격      ③ 채널: 수수료 구조 정합성"
        }
      },
      "assumed": true,
      "footnote": "* 인하 폭은 등급당 5~6% 가정의 예시임"
    }
  ]
}
