{
  "schemaVersion": "deck-spec/1",
  "meta": {
    "title": "새 덱",
    "deckLabel": "새 덱",
    "org": "default",
    "archetype": "status_report",
    "fileName": "새_덱.pptx"
  },
  "definition": {
    "q1": "인지",
    "q2": "종신보험으로 상품구조 transformation을 하려고 하는 것을 인수인계 예정",
    "q3": "상품구조 transformation이 뭔지조차도 잘 모름\n왜 종신보험인지 맥락을 모름\n종신보험 중에서도 건강을 보장하는 시장(선지급종신)은 매우 협소하다\n",
    "q4": "상품구조 트랜스포메이션은 보험기간 중에도 고객의 변경된 니즈를 맞춰줄수 있는 상품구조를 갖추는 것을 말한다.\n변경된 니즈를 맞추기 위해 가장 큰 허들은 보험료며, 종신보험은 적립금 규모가 크기 때문에 적립금을 활용하기 좋다.\n선지급종신에서도 7년 시점 환급률 100%를 맞춰준 상품의 경우, 현재 시장에서 급성장 하고 있다.",
    "q5": "",
    "priors": {
      "seen": "거의 정보가 없는 후배 직원 대상으로 보여줄 예정",
      "criteria": "인수인계 받는 업무의 배경을 알수 있다.\n앞으로 이 업무에서 무엇을 추진해야하는지 알 수 있다.",
      "losers": "없음"
    },
    "archetype": "status_report"
  },
  "slides": [
    {
      "id": "cover",
      "template": "cover",
      "p": {
        "eyebrow": "",
        "title": "새 덱",
        "subtitle": "",
        "credit": ""
      }
    },
    {
      "id": "c2",
      "template": "flow",
      "label": "업무 요약",
      "head": {
        "runs": [
          {
            "t": "상품구조 transformation 및 파일럿 상품개발 전체 업무 리스트를 요약함"
          }
        ]
      },
      "p": {
        "steps": [
          "현황 진단",
          "구조 설계",
          "파일럿 개발",
          "검증·조정",
          "전환 이행"
        ],
        "hi": 3
      },
      "assumed": true,
      "footnote": "* 수치는 가정(예시), 근거 작성 필요"
    },
    {
      "id": "c3",
      "template": "before_after",
      "label": "transformation 정의",
      "head": {
        "runs": [
          {
            "t": "상품구조 transformation이란 보험기간 중에도 고객의 변경된 니즈에 맞게 상품이 변경되는 구조를 목표로 함"
          }
        ]
      },
      "p": {
        "before": "고정 상품구조",
        "after": "니즈 연동 구조",
        "trigger": "Transformation",
        "items": [
          "보험기간 중 변경 가능(예시)",
          "고객 니즈 실시간 반영(예시)",
          "상품 유연성 확보(예시)"
        ]
      },
      "assumed": true,
      "footnote": "* 수치는 가정(예시), 근거 작성 필요"
    },
    {
      "id": "c4",
      "template": "hub",
      "label": "transformation 기능",
      "head": {
        "runs": [
          {
            "t": "리밸런싱 기능, 중도부가/보장전환 기능이 핵심이며 각 기능에 다이나믹 프라이싱을 적용하고자 함"
          }
        ],
        "sub": "해당 기능의 파일럿 테스트를 위하여 고객 데이터 분석을 통해 대상 상품고 타겟 고객을 설정"
      },
      "p": {
        "center": "다이나믹프라이싱",
        "spokes": [
          "리밸런싱",
          "중도부가",
          "보장전환"
        ]
      }
    },
    {
      "id": "c5",
      "template": "matrix",
      "label": "고객 데이터 분석",
      "head": {
        "runs": [
          {
            "t": "신정원 결합 고객 데이터 분석을 통해 고객에게 필요한 기능의 우선순위를 정하고 파일럿으로 검증하고자 함"
          }
        ]
      },
      "p": {
        "xl": "구현 난이도 낮음",
        "xr": "구현 난이도 높음",
        "yb": "고객 필요도 낮음",
        "yt": "고객 필요도 높음",
        "q": [
          "즉시 적용(예시)",
          "파일럿 우선(예시)",
          "보류(예시)",
          "중장기 검토(예시)"
        ],
        "hi": 0
      },
      "assumed": true,
      "footnote": "* 수치는 가정(예시), 근거 작성 필요"
    },
    {
      "id": "c7",
      "template": "matrix",
      "label": "고객 데이터 분석 결과",
      "head": {
        "runs": [
          {
            "t": "사망보험 가입 고객에서 건강보험에 대한 보장 공백이 크게 나타남"
          }
        ]
      },
      "p": {
        "xl": "건강보험 미보유",
        "xr": "건강보험 보유",
        "yb": "사망보험 미보유",
        "yt": "사망보험 보유",
        "q": [
          "▲ 핵심 공백군\n(우선 어프로치)",
          "✓ 보장 완비군",
          "이중 미보유군",
          "사망만 보유군"
        ],
        "hi": 0
      },
      "assumed": true,
      "footnote": "* 수치는 가정(예시), 근거 작성 필요"
    },
    {
      "id": "c8",
      "template": "before_after",
      "label": "파일럿 제안",
      "head": {
        "runs": [
          {
            "t": "종신보험에 무사고전환, 중도부가 및 적립금재원 보장전환 기능을 추가하여 파일럿을 제안함"
          }
        ]
      },
      "p": {
        "before": "기존 종신보험",
        "after": "파일럿 종신보험",
        "trigger": "기능 추가",
        "items": [
          "무사고전환(예시)",
          "중도부가(예시)",
          "적립금 보장전환(예시)",
          "파일럿 운영"
        ]
      },
      "assumed": true,
      "footnote": "* 수치는 가정(예시), 근거 작성 필요"
    }
  ]
}
